{
  "version": "1.0",
  "checkedAt": "2026-09-21T18:30:00Z",
  "status": "prospecting-draft",
  "measurementState": "provider-not-configured",
  "headline": {
    "en": "Decide which partnership opportunity should advance—and what must be true first",
    "es": "Decidir qué oportunidad de partnership debe avanzar y qué debe ser cierto antes"
  },
  "principle": {
    "en": "Start with evidence, blockers and the next internal decision. Only then open the commercial dossier or prepare outreach.",
    "es": "Empezar por evidencia, bloqueos y la siguiente decisión interna. Solo después abrir el dossier comercial o preparar el contacto."
  },
  "fixtures": [
    {
      "fixtureId": "2027-01-24-ars-h",
      "label": {
        "en": "Arsenal · 24 Jan",
        "es": "Arsenal · 24 ene"
      }
    },
    {
      "fixtureId": "2027-02-14-che-h",
      "label": {
        "en": "Chelsea · 14 Feb",
        "es": "Chelsea · 14 feb"
      }
    },
    {
      "fixtureId": "2027-03-14-liv-h",
      "label": {
        "en": "Liverpool · 14 Mar",
        "es": "Liverpool · 14 mar"
      }
    }
  ],
  "packs": [
    {
      "id": "journey-technology-pack",
      "category": "journey-technology",
      "candidate": "Moovit / Citymapper",
      "relationshipState": "candidate-not-contacted",
      "title": {
        "en": "Official matchday journey layer",
        "es": "Capa oficial de trayecto de matchday"
      },
      "proposition": {
        "en": "Make planning and disruption confidence part of the matchday experience.",
        "es": "Convertir planificación y confianza ante incidencias en parte de la experiencia de partido."
      },
      "whyFit": {
        "en": "A technology-led pilot can test journey guidance before any physical service is commissioned.",
        "es": "Un piloto tecnológico puede probar la orientación de trayectos antes de contratar un servicio físico."
      },
      "recommendedFixtureIds": [
        "2027-02-14-che-h"
      ],
      "clubOffers": [
        {
          "en": "Branded matchday journey surface",
          "es": "Superficie de trayecto de partido con marca"
        },
        {
          "en": "Fixture context and approved supporter messaging",
          "es": "Contexto de partido y mensajes aprobados para aficionados"
        },
        {
          "en": "Aggregated experiment reporting when the threshold is met",
          "es": "Informe agregado del experimento cuando se alcance el umbral"
        }
      ],
      "partnerContributes": [
        {
          "en": "Journey-planning capability and live service information",
          "es": "Capacidad de planificación e información de servicio en vivo"
        },
        {
          "en": "Technical implementation and agreed aggregate measures",
          "es": "Implementación técnica y métricas agregadas acordadas"
        }
      ],
      "activationAssets": [
        {
          "en": "Sponsored journey planner",
          "es": "Journey planner patrocinado"
        },
        {
          "en": "T−7 and T−3 travel-confidence content",
          "es": "Contenido de confianza de viaje T−7 y T−3"
        },
        {
          "en": "Matchday disruption module",
          "es": "Módulo de incidencias en matchday"
        }
      ],
      "commercialAsk": {
        "en": "A technical feasibility session and one fixture-scoped pilot review.",
        "es": "Una sesión de viabilidad técnica y revisión piloto para un partido."
      },
      "evidence": [
        {
          "id": "canonical-fixture",
          "label": {
            "en": "Pilot fixture",
            "es": "Partido piloto"
          },
          "state": "public-verified",
          "detail": {
            "en": "Chelsea is present in the canonical home calendar.",
            "es": "Chelsea figura en el calendario canónico de partidos locales."
          }
        },
        {
          "id": "journey-layer",
          "label": {
            "en": "Journey need",
            "es": "Necesidad de trayecto"
          },
          "state": "modelled-scenario",
          "detail": {
            "en": "Three representative corridors are modelled in the mobility layer.",
            "es": "Tres corredores representativos están modelados en la capa de movilidad."
          }
        },
        {
          "id": "usage-proof",
          "label": {
            "en": "Supporter usage",
            "es": "Uso de aficionados"
          },
          "state": "requires-measurement",
          "detail": {
            "en": "Planner use and transport intent remain unmeasured.",
            "es": "El uso del planner y la intención de transporte siguen sin medirse."
          }
        },
        {
          "id": "technical-scope",
          "label": {
            "en": "Integration scope",
            "es": "Alcance de integración"
          },
          "state": "requires-partner",
          "detail": {
            "en": "API, branding and reporting scope require partner agreement.",
            "es": "API, branding e informes requieren acuerdo con el partner."
          }
        }
      ],
      "kpis": [
        {
          "id": "planner-opens",
          "label": {
            "en": "Journey planner opens",
            "es": "Aperturas del journey planner"
          },
          "state": "requires-instrumentation"
        },
        {
          "id": "route-completes",
          "label": {
            "en": "Routes completed",
            "es": "Rutas completadas"
          },
          "state": "requires-partner"
        },
        {
          "id": "ticket-conversion",
          "label": {
            "en": "Ticket conversion",
            "es": "Conversión a entrada"
          },
          "state": "requires-access"
        }
      ]
    },
    {
      "id": "rail-pack",
      "category": "rail",
      "candidate": "Southeastern",
      "relationshipState": "candidate-not-contacted",
      "title": {
        "en": "Station-to-stadium matchday corridor",
        "es": "Corredor de estación a estadio en matchday"
      },
      "proposition": {
        "en": "Turn rail arrival confidence into a visible part of the fixture campaign.",
        "es": "Convertir la confianza de llegada en tren en parte visible de la campaña del partido."
      },
      "whyFit": {
        "en": "A rail-led test can connect station messaging, planned arrival and the final leg to Hayes Lane.",
        "es": "Una prueba ferroviaria puede conectar mensajes en estación, llegada planificada y último tramo a Hayes Lane."
      },
      "recommendedFixtureIds": [
        "2027-01-24-ars-h",
        "2027-02-14-che-h"
      ],
      "clubOffers": [
        {
          "en": "Fixture campaign and owned-channel inventory",
          "es": "Campaña del partido e inventario de canales propios"
        },
        {
          "en": "Station-to-ground matchday narrative",
          "es": "Narrativa de estación a estadio"
        },
        {
          "en": "Fanzone visibility subject to approval",
          "es": "Visibilidad en fanzone sujeta a aprobación"
        }
      ],
      "partnerContributes": [
        {
          "en": "Approved rail information and disruption workflow",
          "es": "Información ferroviaria aprobada y flujo de incidencias"
        },
        {
          "en": "Feasibility of station-led activation",
          "es": "Viabilidad de activación desde estaciones"
        }
      ],
      "activationAssets": [
        {
          "en": "Official rail arrival guide",
          "es": "Guía oficial de llegada en tren"
        },
        {
          "en": "Station meeting-point concept",
          "es": "Concepto de punto de encuentro en estación"
        },
        {
          "en": "Live disruption message templates",
          "es": "Plantillas de mensajes de incidencias"
        }
      ],
      "commercialAsk": {
        "en": "An exploratory corridor workshop covering information, activation and measurement feasibility.",
        "es": "Un workshop exploratorio sobre información, activación y viabilidad de medición del corredor."
      },
      "evidence": [
        {
          "id": "fixtures",
          "label": {
            "en": "Pilot fixtures",
            "es": "Partidos piloto"
          },
          "state": "public-verified",
          "detail": {
            "en": "Arsenal and Chelsea resolve to canonical home fixtures.",
            "es": "Arsenal y Chelsea resuelven a partidos locales canónicos."
          }
        },
        {
          "id": "corridors",
          "label": {
            "en": "Corridor opportunity",
            "es": "Oportunidad de corredor"
          },
          "state": "modelled-scenario",
          "detail": {
            "en": "Bromley, East Croydon and Lewisham / Grove Park are planning scenarios.",
            "es": "Bromley, East Croydon y Lewisham / Grove Park son escenarios de planificación."
          }
        },
        {
          "id": "demand",
          "label": {
            "en": "Aggregate travel demand",
            "es": "Demanda agregada de viaje"
          },
          "state": "requires-measurement",
          "detail": {
            "en": "No production cohort has reached the evidence threshold.",
            "es": "Ninguna cohorte de producción ha alcanzado el umbral de evidencia."
          }
        },
        {
          "id": "rail-terms",
          "label": {
            "en": "Rail participation",
            "es": "Participación ferroviaria"
          },
          "state": "requires-partner",
          "detail": {
            "en": "No inventory, media or operational support is agreed.",
            "es": "No se ha acordado inventario, medios ni soporte operativo."
          }
        }
      ],
      "kpis": [
        {
          "id": "guide-reach",
          "label": {
            "en": "Travel-guide reach",
            "es": "Alcance de la guía"
          },
          "state": "public-measurable"
        },